{
  "schema_version": "proof-dag-schema-v0.4",
  "graph_kind": "reference",
  "graph_id": "0le0-reference-v0.1",
  "problem_id": "0le0",
  "target_fact_ids": [
    "F17"
  ],
  "versions": {
    "skill_standard": "0.3",
    "dag_schema": "proof-dag-schema-v0.4",
    "fact_schema": "fact-v0.4",
    "inference_schema": "inference-v0.4",
    "scope_schema": "scope-v0.4",
    "mutation_schema": "mutation-v0.4",
    "canonicalizer": "math-expression-v1",
    "rule_registry": "discrete_algebra-pilot-rules-v1",
    "common_tooling": "proof-dag-lean-v0.4",
    "domain_skill": "olympiad-algebra-expert-v0.1"
  },
  "source_record": {
    "problem_source": "HuggingFace:ShadenA/MathNet problem 0le0",
    "solution_source": "human-reviewed blind proof in algebra curriculum",
    "source_record_id": "mathnet:0le0",
    "source_hash": "ea67bcdd2fc804044b069710371bb3e2c13397af6b69532b5e33135c772208d2",
    "candidate_reference_solution_hash": "ea67bcdd2fc804044b069710371bb3e2c13397af6b69532b5e33135c772208d2",
    "reviewed_solution_hash": "ea67bcdd2fc804044b069710371bb3e2c13397af6b69532b5e33135c772208d2"
  },
  "scopes": [
    {
      "id": "global",
      "parent_id": null,
      "kind": "global"
    },
    {
      "id": "global/case_even_mass_zero",
      "parent_id": "global",
      "kind": "case"
    },
    {
      "id": "global/case_even_mass_positive",
      "parent_id": "global",
      "kind": "case"
    }
  ],
  "rule_schemas": [
    {
      "rule_id": "R1",
      "name": "Read floor parity from the last finite binary digit",
      "category": "discrete_algebra",
      "input_patterns": [
        {
          "premise_role": "domain",
          "predicate": "ProblemDomain"
        },
        {
          "premise_role": "digits",
          "predicate": "FiniteBinaryDigits"
        }
      ],
      "variables": [],
      "variable_constraints": [],
      "output_pattern": {
        "predicate": "FloorParityDigit",
        "canonical_form": "FloorParityDigit(a,d,j)"
      },
      "scope_constraints": [
        "inputs_visible_from_inference_scope"
      ],
      "version": 1
    },
    {
      "rule_id": "R2",
      "name": "Finite floor digits determine the binary cylinder",
      "category": "discrete_algebra",
      "input_patterns": [
        {
          "premise_role": "digits",
          "predicate": "FiniteBinaryDigits"
        },
        {
          "premise_role": "digit_masses",
          "predicate": "DigitMasses"
        }
      ],
      "variables": [],
      "variable_constraints": [],
      "output_pattern": {
        "predicate": "BinaryCylinderConstancy",
        "canonical_form": "BinaryCylinderConstancy(O,E,s,h)"
      },
      "scope_constraints": [
        "inputs_visible_from_inference_scope"
      ],
      "version": 1
    },
    {
      "rule_id": "R3",
      "name": "Evaluate odd and even finite geometric sums",
      "category": "discrete_algebra",
      "input_patterns": [
        {
          "premise_role": "parity",
          "predicate": "FloorParityDigit"
        },
        {
          "premise_role": "digit_masses",
          "predicate": "DigitMasses"
        },
        {
          "premise_role": "odd_length",
          "predicate": "ProblemDomain"
        }
      ],
      "variables": [],
      "variable_constraints": [],
      "output_pattern": {
        "predicate": "FiniteSumFormula",
        "canonical_form": "FiniteSumFormula(A,C,O,E,h)"
      },
      "scope_constraints": [
        "inputs_visible_from_inference_scope"
      ],
      "version": 1
    },
    {
      "rule_id": "R4",
      "name": "Use monotonicity of the quadratic on each cylinder",
      "category": "discrete_algebra",
      "input_patterns": [
        {
          "premise_role": "domain",
          "predicate": "ProblemDomain"
        },
        {
          "premise_role": "constancy",
          "predicate": "BinaryCylinderConstancy"
        },
        {
          "premise_role": "sum_formula",
          "predicate": "FiniteSumFormula"
        }
      ],
      "variables": [],
      "variable_constraints": [],
      "output_pattern": {
        "predicate": "CylinderEndpointReduction",
        "canonical_form": "CylinderEndpointReduction(a,s)"
      },
      "scope_constraints": [
        "inputs_visible_from_inference_scope"
      ],
      "version": 1
    },
    {
      "rule_id": "R5",
      "name": "Algebraically reduce the endpoint inequality to G>=0",
      "category": "discrete_algebra",
      "input_patterns": [
        {
          "premise_role": "sum_formula",
          "predicate": "FiniteSumFormula"
        },
        {
          "premise_role": "endpoint",
          "predicate": "CylinderEndpointReduction"
        }
      ],
      "variables": [],
      "variable_constraints": [],
      "output_pattern": {
        "predicate": "ReducedInequality",
        "canonical_form": "ReducedInequality(G,O,E,s,h)"
      },
      "scope_constraints": [
        "inputs_visible_from_inference_scope"
      ],
      "version": 1
    },
    {
      "rule_id": "R6",
      "name": "Use the truncated upper endpoint when E=0",
      "category": "discrete_algebra",
      "input_patterns": [
        {
          "premise_role": "case",
          "predicate": "EvenMassZero"
        },
        {
          "premise_role": "domain",
          "predicate": "ProblemDomain"
        },
        {
          "premise_role": "reduction",
          "predicate": "ReducedInequality"
        }
      ],
      "variables": [],
      "variable_constraints": [],
      "output_pattern": {
        "predicate": "ZeroCaseBound",
        "canonical_form": "ZeroCaseBound(G,s,h)"
      },
      "scope_constraints": [
        "inputs_visible_from_inference_scope"
      ],
      "version": 1
    },
    {
      "rule_id": "R7",
      "name": "Discharge the E=0 case",
      "category": "discrete_algebra",
      "input_patterns": [
        {
          "premise_role": "case",
          "predicate": "EvenMassZero"
        },
        {
          "premise_role": "bound",
          "predicate": "ZeroCaseBound"
        }
      ],
      "variables": [],
      "variable_constraints": [],
      "output_pattern": {
        "predicate": "ZeroCaseConclusion",
        "canonical_form": "ZeroCaseConclusion(G,s,h)"
      },
      "scope_constraints": [
        "inputs_visible_from_inference_scope",
        "allow_scope_discharge"
      ],
      "version": 1
    },
    {
      "rule_id": "R8",
      "name": "Identify the least positive even-position digit mass",
      "category": "discrete_algebra",
      "input_patterns": [
        {
          "premise_role": "case",
          "predicate": "EvenMassPositive"
        },
        {
          "premise_role": "digits",
          "predicate": "FiniteBinaryDigits"
        },
        {
          "premise_role": "scale",
          "predicate": "ProblemDomain"
        }
      ],
      "variables": [],
      "variable_constraints": [],
      "output_pattern": {
        "predicate": "LeastEvenContribution",
        "canonical_form": "LeastEvenContribution(E,h)"
      },
      "scope_constraints": [
        "inputs_visible_from_inference_scope"
      ],
      "version": 1
    },
    {
      "rule_id": "R9",
      "name": "Lower-bound G using E>=2h and d_1=1",
      "category": "discrete_algebra",
      "input_patterns": [
        {
          "premise_role": "case",
          "predicate": "EvenMassPositive"
        },
        {
          "premise_role": "least_mass",
          "predicate": "LeastEvenContribution"
        },
        {
          "premise_role": "reduction",
          "predicate": "ReducedInequality"
        },
        {
          "premise_role": "domain",
          "predicate": "ProblemDomain"
        }
      ],
      "variables": [],
      "variable_constraints": [],
      "output_pattern": {
        "predicate": "PositiveCaseBound",
        "canonical_form": "PositiveCaseBound(G)"
      },
      "scope_constraints": [
        "inputs_visible_from_inference_scope"
      ],
      "version": 1
    },
    {
      "rule_id": "R10",
      "name": "Discharge the E>0 case",
      "category": "discrete_algebra",
      "input_patterns": [
        {
          "premise_role": "case",
          "predicate": "EvenMassPositive"
        },
        {
          "premise_role": "strict_bound",
          "predicate": "PositiveCaseBound"
        }
      ],
      "variables": [],
      "variable_constraints": [],
      "output_pattern": {
        "predicate": "PositiveCaseConclusion",
        "canonical_form": "PositiveCaseConclusion(G)"
      },
      "scope_constraints": [
        "inputs_visible_from_inference_scope",
        "allow_scope_discharge"
      ],
      "version": 1
    },
    {
      "rule_id": "R11",
      "name": "Split the nonnegative even digit mass",
      "category": "discrete_algebra",
      "input_patterns": [
        {
          "premise_role": "digit_masses",
          "predicate": "DigitMasses"
        }
      ],
      "variables": [],
      "variable_constraints": [],
      "output_pattern": {
        "predicate": "EvenMassCaseExhaustive",
        "canonical_form": "EvenMassCaseExhaustive(E)"
      },
      "scope_constraints": [
        "inputs_visible_from_inference_scope"
      ],
      "version": 1
    },
    {
      "rule_id": "R12",
      "name": "Combine both cases and translate the equality prefix",
      "category": "discrete_algebra",
      "input_patterns": [
        {
          "premise_role": "zero_case",
          "predicate": "ZeroCaseConclusion"
        },
        {
          "premise_role": "positive_case",
          "predicate": "PositiveCaseConclusion"
        },
        {
          "premise_role": "exhaustiveness",
          "predicate": "EvenMassCaseExhaustive"
        },
        {
          "premise_role": "endpoint_reduction",
          "predicate": "CylinderEndpointReduction"
        }
      ],
      "variables": [],
      "variable_constraints": [],
      "output_pattern": {